{
  "schema_version": 2,
  "scope_id": "m1-orchestrator",
  "facet": "Overall review (code-review)",
  "facet_slug": "overall",
  "status": "Approved with nits",
  "findings": [
    {
      "priority": 2,
      "title": "[P2] Inactivity timer can fire during a new PTT interaction",
      "body": "`last_action_at_ms` is only updated on `STAFF_PTT_UP` (and consent button). If a user presses PTT near the 300s timeout, a `TICK` before they release can still see the old timestamp and force a return to ROOM mid-recording, even though activity has started. To avoid premature timeouts, update `last_action_at_ms` when entering `listening` (e.g., on `STAFF_PTT_DOWN`).",
      "confidence_score": 0.46,
      "code_location": {
        "repo_relative_path": "server/src/orchestrator.ts",
        "line_range": {
          "start": 307,
          "end": 314
        }
      }
    }
  ],
  "overall_correctness": "patch is correct",
  "overall_explanation": "One correctness edge case around inactivity timing during PTT start; otherwise the diff looks consistent with the stated contract.",
  "overall_confidence_score": 0.58,
  "questions": [],
  "uncertainty": []
}
